id;documento
37;"Por unanimidade, os integrantes da Mesa Diretora do Senado decidiram aceitar o pedido do Conselho de Ética de encaminhar para a Polícia Federal pedido para realização de nova perícia nos documentos do presidente da Casa, Renan Calheiros (PMDB-AL). Renan é alvo de um processo por quebra de decoro acusado de receber recursos da construtora Mendes Junior para pagamento de despesas pessoais, como aluguel e pensão para a jornalista Mônica Veloso, com quem tem uma filha. ""A Mesa decide acolher a solicitação do Conselho de Ética e remetê-la ao ministro da Justiça para cumprimento da estrita norma constitucional"", disse o vice-presidente do Senado, Tião Viana (PT-AC), que presidiu a reunião de hoje da Mesa. Renan negou as acusações e disse que fez os pagamentos com recursos próprios. Para comprovar que fez os pagamentos, Renan justificou que teve altos ganhos com a venda de gado. A nova perícia da PF permitirá comprovar a veracidade de documentos apresentados por Renan para justificar esses ganhos. Os novos relatores do processo contra o peemedebista no Conselho de Ética concluíram que era necessário aprofundar as perícias nos documentos enviados por Renan. A oposição prometeu fazer vigília para garantir a realização da reunião de hoje da Mesa Diretora. A estratégia foi montada para evitar novos atrasos no processo contra Renan. O presidente do Senado descumpriu um acordo fechado com a oposição na semana passada para aprovação da LDO (Lei de Diretrizes Orçamentárias) que previa que a reunião da Mesa ocorreria na última quinta-feira. Ontem, Renan negou que pretendesse recorrer ao STF (Supremo Tribunal Federal) para impedir uma nova perícia da Polícia Federal nos documentos encaminhados em sua defesa ao Conselho de Ética do Senado. No entanto, ele questionou na semana passada o poder do Conselho de Ética de pedir para a PF fazer essa perícia. Ele encaminhou um ofício ao procurador-geral da República, Antonio Fernando Souza, com pedido para que o Ministério Público Federal investigue os documentos encaminhados por ele ao Conselho de Ética. No ofício, ele diz que a PGR (Procuradoria Geral da República) é a instância adequada para investigar a autenticidade de seus documentos. ""Considerando que constitucionalmente Vossa Excelência é a autoridade competente para deflagrar investigações e processos judiciais criminais contra os membros do Congresso, venho perante essa digna PGR requerer a verificação da autenticidade dos documentos adunados"", afirmou Renan no ofício. O presidente do Senado argumenta que o Conselho de Ética da Casa não tem poderes para investigar seus documentos. ""A PF, desbordando a tarefa que lhe foi solicitada pelo Conselho de Ética e investigando, sem a autorização do Supremo Tribunal Federal um senador da República, apresentou conclusões que estabelecem confusão sobre os seus acertos."""
38;"O presidente do Conselho de Ética do Senado, Leomar Quintanilha (PMDB-TO), disse hoje ser contrário à unificação dos processos contra o senador Renan Calheiros (PMDB-AL) que tramitam na Casa Legislativa. A unificação foi proposta nesta terça-feira pela bancada do PT no Senado. Na opinião de Quintanilha, uma única investigação sobre diversas denúncias não permite conclusões distintas sobre o suposto envolvimento de Renan em ações que possam configurar a quebra do decoro parlamentar. ""Eu defendo a tese de que cada representação deve ter tratamento distinto. Vamos unificar se eu for voto vencido"", disse. Quintanilha afirmou que vai manter a ""coerência"" em sua decisão, uma vez que negou pedido do PSOL para incluir as novas denúncias contra Renan no primeiro processo contra o peemedebista que entrou na pauta do plenário do Senado na semana passada. ""Eu vou manter a coerência da minha decisão. Eu acho que vão confundir as acusações se tudo for analisado conjuntamente. Eu advogo a causa do tratamento distinto a cada representação."" A unificação dos processos tem o apoio da bancada do PT no Senado e do PSOL, partido que ingressou com três das quatro representações contra Renan. O senador José Nery (PSOL-PA) questionou apenas o fato da unificação estar sendo discutida neste momento, já que há alguns meses o Conselho de Ética negou o pedido da legenda para reunir as denúncias contra Renan em uma única peça. ""Tentamos fazer um aditamento, o conselho nos respondeu que não seria possível. O nosso entendimento é que todas as representações tratam de possível quebra de decoro. Esse conjunto de denúncias poderia ser agregado em um único processo. Ficou fatiado nesse monte de processos porque o conselho assim o quis"", criticou Nery. Quintanilha disse que, mesmo se a unificação dos processos for aprovada pelo conselho, vai defender relatores distintos para cada uma das denúncias contra Renan. Mas reconheceu que, dificilmente, os relatores terão posições semelhantes nas representações. ""Quem garante que vão trabalhar ao mesmo tempo, com cronograma similar? E se um tiver um entendimento sobre as denúncias e os outros não concordarem? Isso dificulta os trabalhos"", afirmou. Na opinião do senador Aloizio Mercadante (PT-SP), o plenário da Casa não deve analisar separadamente as três representações contra Renan que tramitam no Senado. ""Nós devemos analisar as três representações que faltam, oferecer um relatório completo das três para que cada um forme definitivamente o seu julgamento de mérito"", defendeu. O Conselho de Ética vai decidir sobre a unificação dos processos contra Renan em reunião marcada para a próxima quarta-feira. No mesmo dia, o conselho vai discutir o relatório do senador João Pedro (PT-AM) sobre o segundo processo contra o peemedebista --no qual é acusado de usar sua influência política para beneficiar a empresa Schincariol."
39;"A polícia de São Paulo afirmou ontem ter detido dois suspeitos de ter participado do roubo do relógio Rolex do apresentador Luciano Huck, da TV Globo, em um semáforo do Itaim Bibi (zona oeste de SP). ""O delegado me telefonou com a notícia. Estou indo para São Paulo amanhã [hoje] para fazer o reconhecimento"", disse Huck, que usava um relógio Nike, à Folha, em camarote VIP no Maracanã, no Rio, onde assistiu ontem ao jogo da seleção brasileira contra o Equador. Um dos suspeitos detidos pela polícia, 17 dias após o assalto, é o garçom Wagner do Nascimento Marinho, 22. De acordo com o Deic (Departamento de Investigações sobre Crime Organizado), ele estava foragido da penitenciária de Valparaiso (a 577 km de SP) onde cumpria pena por tentativa de roubo seguida de tentativa de homicídio e por roubo de outro relógio, também da marca suíça Rolex. O outro suspeito tem 27 anos, é grafiteiro e, segundo o Deic, tem passagem por roubo, mas já cumpriu a pena. A polícia não divulgou o nome dele. O Deic diz que prendeu o garçom e o grafiteiro seguindo informações de um informante da delegacia, segundo o qual os dois teriam roubado --e já vendido-- o acessório de luxo do apresentador da TV Globo, avaliado em cerca de R$ 10 mil. A prisão aconteceu em Taboão da Serra, na Grande São Paulo. Wagner, afirma o Deic, apresentou identidade falsa com nome de Antônio Edgar Torres Câmara ao ser abordado pelos policiais. Com ele, foi encontrada também uma moto Honda Twister prateada. O assalto ao apresentador, em um semáforo do Itaim (zona oeste), veio à tona após artigo publicado pelo apresentador na Folha, no dia 1º de outubro. No texto, Huck afirmava: ""Passei um dia na cidade nesta semana -moro no Rio por motivos profissionais- e três assaltos passaram por mim. Meu irmão, uma funcionária e eu. Foi-se um relógio que acabara de ganhar da minha esposa em comemoração ao meu aniversário. Todos nos Jardins, com assaltantes armados, de motos e revólveres... Onde está a polícia? Onde está a ""Elite da Tropa'? Quem sabe até a ""Tropa de Elite'! Chamem o comandante Nascimento!"" Huck, porém, não registrou queixa do roubo. Ele alegou que, por motivos profissionais, não teve tempo de ir à polícia. O Deic anunciará, em entrevista coletiva, na tarde de hoje, a prisão do comerciante Jurandi Ferreira Santos, 48, acusado por vender jóias roubadas. Ele foi preso ontem em uma sala comercial da rua Barão de Itapetininga, no centro, que funcionava como ponto-de-venda de jóias roubadas, dólares, euros e cheques de viagem. A polícia ainda tentará identificar os donos das jóias roubadas. Também foram presos José Ailton dos Santos, 29, e João Alcino da Silva, 29, que, segundo o Deic, trabalhavam como vendedores das mercadorias."
40;Um terremoto de 6,8 graus na escala Richter atingiu a costa noroeste do Japão nesta segunda-feira, 16, matando pelo menos sete pessoas na cidade de Kashiwazaki e deixando outros 700 feridos. Equipes de resgate continuam procurando por pessoas em meio aos escombros. Chamas e rolos de fumaça preta foram vistos na usina nuclear de Kashiwazaki, que foi automaticamente fechada durante o terremoto. Segundo a TV NHK, o fogo atingiu um transformador de eletricidade e não houve vazamento de radiação. A força do abalo danificou estradas e pontes na costa. Cerca de 2 mil moradores de Kashiwazaki, a cidade mais afetada pelo tremor, tiveram de deixar suas casas. Cerca de 300 edifícios da cidade ficaram destruídos. Rachaduras de um metro de largura foram vistas no solo ao longo do litoral. A Agência de Meteorologia divulgou alertas de tsunami para o estado de Niigata e a região costeira das redondezas, mas por fim o aviso foi cancelado. O tremor atingiu a região às 10h13 (horário local, 22h13 de domingo, em Brasília) e seu epicentro foi localizado a 260 km da costa de Niigata, ao nordeste da capital, Tóquio, onde também foi sentido. Uma série de pequenos abalos secundários atingiu a área, dentre eles um de 4,2 graus. Segundo Koichi Uhira, da Agência de Meteorologia, esses tremores podem continuar por uma semana. Vários serviços de trem bala ligando Tóquio ao norte e ao nordeste do país foram suspensos. Informações oficiais indicam que o fornecimento de água e gás para as 35 mil residências de Kashiwazaki foi cortado depois que foram constatados vazamentos de gás. Cerca de 27 mil famílias estavam sem energia elétrica na manhã desta segunda-feira em Niigata.
41;"O Parlamento da Turquia aprovou por ampla maioria (507 votos contra 19), nesta quarta-feira, um pedido do governo para permitir que tropas do país cruzem a fronteira para o norte do Iraque, a fim de combater rebeldes separatistas curdos refugiados na região montanhosa. A medida fez com que o preço do petróleo disparasse no cenário internacional , mas a Petrobras garantiu que isso não interferirá no mercado de combustíveis brasileiro. Pouco antes de o Congresso dar o sinal verde à operação militar, o primeiro-ministro da Turquia, o islamita Recep Tayyip Erdogan, disse que ""a paciência do povo turco se esgotou"" com as ações dos guerrilheiros separatistas curdos do Partido dos Trabalhadores do Curdistão (conhecido como PKK) que estão refugiados no Norte do Iraque. A possibilidade de incursão militar da Turquia, que é membro da Otan (organização militar que reúne 26 países, entre eles EUA, Grã-Bretanha, França e Alemanha), no Iraque está deixando a Casa Branca em estado de alerta. O presidente dos EUA, George W. Bush, pediu nesta quarta-feira que o Exército turco busque uma solução diplomática para a questão. Washington teme que uma incursão turca possa desestabilizar a mais pacífica região iraquiana e, provavelmente, toda a região do Oriente Médio, levando o Irã, seu arquiinimigo, a intervir. A Comissão Européia, por sua vez, exortou a Turquia a respeitar a integridade do território iraquiano. - É crucial que a Turquia continue a atacar esse problema pela cooperação entre as autoridades relevantes - declarou Krisztina Nagy, porta-voz da Comissão Européia. Erdogan deu de ombros às preocupações de aliados da Otan: - O que importa é o que o Parlamento diz. O premier está sob forte pressão interna por causa de uma série de ataques cometidos por guerrilheiros curdos que usam o Norte do Iraque como base. Em Istambul, maior cidade turca, professores e estudantes realizaram grande manifestação contra o terrorismo e a política externa dos EUA."
42;"A torcida recebeu Bernardinho com vaias e gritos de ""Ricardinho"" na estréia da seleção de vôlei no Pan do Rio, ontem. Nem o levantador Bruninho, filho do técnico e novo jogador da equipe, foi poupado. Quando ele entrou em quadra, no fim do primeiro set, o Maracanãzinho, lotado, dividiu-se entre apupos e gritos de incentivo. Quando o nome do treinador foi anunciado, parte dos torcedores também o vaiou. As arquibancadas estavam cheias de cartazes de apoio ao levantador Ricardinho, cortado no sábado. O time atuou com faixas pretas nos braços em homenagem às vítimas do acidente em Congonhas. Em quadra, foi a equipe que mostrou distanciamento do técnico. No banco, ele tinha de procurar os jogadores, um por um, para dar instruções. Bernardinho também foi muito mais contido do que costuma ser durante a partida, gritou e gesticulou pouco, nos erros e nos acertos. ""Não somos unanimidade como querem fazer crer, nem tão ruins como podem fazer parecer. As vaias também são boas porque te colocam em uma dimensão mais humana. Quantas vezes não fui vaiado porque os torcedores queriam ver o William jogar?"", perguntou o técnico. Mesmo com altos e baixos, a equipe brasileira não teve muito trabalho para superar o fraco time do Canadá por 3 sets a 0 (25/18, 25/19 e 25/17), em uma hora e dez minutos. O confronto de hoje será contra Cuba, às 22h. Os cubanos são considerados por Bernardinho como os rivais mais perigosos da fase classificatória. ""Eles são uma fábrica de fazer atletas, têm muito vigor físico e saque e ataque muito pesados"", afirmou o treinador. Para essa partida, os jogadores esperam uma posição diferente da torcida. Ontem, vários se mostraram contrariados com as vaias. ""Foi muito chato. Fiquei surpreso porque ninguém espera isso quando joga em casa. O Ricardinho faz falta, mas a responsabilidade foi passada para o Marcelinho e o Bruno, e a torcida tem que apoiá-los"", disse Escadinha. Bruninho, que faz sua estréia em Pans, minimizou a hostilidade dos torcedores. E, após a partida, fez questão de cumprimentar Marcelinho, novo levantador titular, pela atuação. ""Ouvi alguma coisa [vaias] quando eu entrei. É normal, todo mundo queria que o Ricardinho estivesse aqui, eu também. Mas, com o tempo, a torcida vai se acostumar e apoiar, como fez no restante do jogo"", afirmou. Na quadra, a seleção mostrou estar bastante nervosa. Cometeu vários erros de ataque no começo do jogo, principalmente com Giba, só o quarto maior pontuador do time (8 pontos). No total, a equipe cedeu 14 pontos ao adversário, pouco se comparado aos 29 dos canadenses, que ofereceram resistência apenas no terceiro set. O destaque foi Dante, que anotou 12 pontos -3 aces. ""A gente sentiu a tensão da estréia. Se a gente perdesse..."", disse Anderson."
43;"O presidente Luiz Inácio Lula da Silva afirmou nesta segunda-feira, durante o programa de rádio ""Café com o Presidente"", que ficou triste com as vaias que recebeu durante a abertura oficial da 15ª edição dos Jogos Pan-Americanos, realizada no estádio do Maracanã, no Rio de Janeiro. ""A vaia e o aplauso são dois momentos de reação do ser humano. A única coisa que eu, particularmente, fico triste é que eu fui preparado para uma festa. É como se eu fosse convidado para o aniversário de um amigo meu, chegasse lá e encontrasse um grupo de pessoas que não queria a minha presença lá. Eu tenho certeza de que não é esse o pensamento do Rio de Janeiro. Depois que terminou o evento, várias pessoas vieram dizer que tinha sido organizado, que gente tinha recebido o convite. A mim, não me interessa o que aconteceu, já aconteceu. O importante é que foi uma abertura extraordinária dos Jogos Pan-Americanos"", afirmou. Lula ainda comentou a importância do Pan para o Rio. ""Eu tenho consciência do que representa o Rio para o Brasil. Eu tenho consciência de que o povo do Rio de Janeiro tem sua auto-estima nesse momento muito melhor do que tinha três, quatro anos atrás. Nós vamos trabalhar, nós temos muitos projetos para trabalhar no Rio de Janeiro e vamos trabalhar no Rio de Janeiro. Isso [as vaias] não muda um milímetro do meu comportamento com o Rio de Janeiro. O Rio de Janeiro a gente poderia dizer continua lindo e merece que o governo federal faça o que for possível para o Rio de Janeiro."" E reiterou: ""A festa foi uma coisa extraordinária. Antes da festa, eu tive a oportunidade de visitar a Vila Olímpica e conversar com atletas de vários países do mundo que estavam lá. Era unânime dizer que ninguém nunca tinha visto nada com a qualidade que o Brasil estava oferecendo na Vila Olímpica. Os atletas dizendo sobre as quadras que eles iriam participar"". O presidente também falou sobre os investimentos do governo federal para os centros esportivos. ""Eu acredito que é preciso que todos nós brasileiros tenhamos consciência de que o Rio de Janeiro merecia um evento dessa magnitude. Merecia os investimentos que o governo federal colocou lá, R$ 2 bilhões. Colocamos porque nós temos consciência de que o Rio de Janeiro é um Estado importante para o Brasil, que é importante a gente mostrar uma qualidade extraordinária dos serviços que nós estamos oferecendo, sobretudo para o local dos eventos em que os atletas vão participar, para a questão da segurança pública."""
44;O CGE (Centro de Gerenciamento de Emergências) da Prefeitura de São Paulo registrava oito pontos de alagamento na cidade, às 9h30 desta segunda-feira. Naquele horário, segundo a CET (Companhia de Engenharia de Tráfego), havia 110 km de congestionamento em toda a cidade enquanto a média para o horário era de 76 km. O congestionamento esteve ainda maior às 9h, quando chegou a 113 km de extensão para uma média de 32 km. Segundo o CGE, às 9h30 havia alagamentos no viaduto José Colassuono, na pista expressa da avenida Alcântara Machado, sentido bairro, altura da rua Doutor Fomm, na avenida Airton Pretini, sentido centro, na avenida Magalhães de Castro, sentido Castello Branco, na avenida das Nações Unidas, sentido Castello Branco, na rua João Alfredo, sentido centro, na marginal Tietê, sentido centro, e na avenida Otaviano Alves de Lima, sentido Castello Branco. O estado de atenção na cidade foi suspenso às 9h25. Ele havia sido decretado pelo CGE devido ao risco de que novos alagamentos surgissem. Os motoristas, ainda às 9h30, enfrentavam trânsito lento principalmente na pista expressa da marginal Pinheiros, sentido Interlagos, no corredor norte-sul (avenidas 23 de Maio, Rubem Berta e Moreira Guimarães), sentido Santana, na Radial Leste, sentido centro, e na avenida dos Bandeirantes, sentido marginal. Não havia registro de acidentes graves, ainda às 9h30. O Corpo de Bombeiros de São Paulo registrava apenas uma ocorrência grave ligada à chuva, às 9h30. Três pessoas --incluindo uma criança-- teriam ficado ilhadas em uma casa na rua Quimili, no Jardim Alfredo (zona sul de São Paulo). Não há informações sobre o estado de saúde dos envolvidos.
45;"O ministro da Fazenda, Guido Mantega, apresentou nesta terça-feira a proposta do governo em troca do apoio do PSDB na votação da PEC (Proposta de Emenda Constitucional) que prorroga a cobrança da CPMF (Contribuição Provisória sobre Movimentação Financeira) até 2011. A proposta prevê isenção de CPMF para trabalhadores assalariados que recebem até R$ 4.340 mensais. O PSDB, entretanto, considerou insuficiente. Ao final do encontro, os senadores tucanos disseram que esperam que o governo apresente uma contraproposta nas próximas horas. ""Vamos fazer uma análise global [da proposta]. Isso é nitidamente insuficiente para convencer o PSDB"", afirmou o líder do partido no Senado, Arthur Virgílio (AM). A proposta inicial do governo previa isenção para salários de até R$ 1.640 por mês. Mantega informou aos tucanos que as medidas apresentadas hoje representariam uma isenção de R$ 4 bilhões no ano que vem e chegaria a cinco em 2009. Desse total, R$ 2,68 bilhões seriam só de CPMF. Para Virgílio, o governo ainda pode avançar na proposta. ""Sentimos que eles ainda têm um limite de gordura para queimar."" Ele defende que o governo caminhe no sentido de reduzir o gasto público e a carga tributária. Os tucanos esperam agora uma melhora da proposta do governo. A que foi feita hoje será levada para o conhecimento da bancada. ""Nós queremos que se faça mais ou o governo vai ter que concordar com o voto contrário"", ameaçou o senador. Segundo o presidente nacional da legenda, senador Tasso Jereissati (CE), o PSDB adiou a reunião, prevista para hoje à noite, porque a proposta seria ""muito complexa"" e precisa ser estudada. ""A proposta do governo não mexe no bolso dele. É só mudança no fluxo de caixa"", afirmou ele as propostas de desonerações para as empresas. A PEC que prorroga a cobrança da CPMF está tramitando no Senado, onde precisa de 49 votos para ser aprovada. A proposta apresentada hoje dá isenção total para os salários até R$ 4.340. Acima desse valor, a isenção é parcial limitada a R$ 214 no ano. Para uma renda de até R$ 1.640, a compensação seria feita por meio da contribuição ao INSS (Instituto Nacional do Seguro Social). Acima desse valor e até R$ 4.340, o trabalhador teria uma espécie de bônus na declaração do Imposto de Renda que fará com que ele receba uma restituição maior ou pague menos impostos. O valor está limitado a R$ 214, que é o equivalente ao ""imposto do cheque"" incidente sobre um salário de R$ 4.340 pelo período de um ano (incluindo o 13º salário). Quem ganha mais de R$ 4.340 também, na proposta do governo, poderá usar esse abatimento, mas limitado a R$ 214. Outra novidade é que o governo propôs é limitar o crescimento de gastos correntes em 2,5% ao ano --já descontada a inflação."
46;O ministro da Defesa, Nelson Jobim, deve encaminhar o nome da economista Solange Vieira para assumir uma das diretorias da Agência Nacional de Aviação Civil (Anac). Ainda não está definida a diretoria que a economista vai assumir. Inicialmente, Solange Vieira, que é assessora especial de Jobim havia sido escolhida para comandar a Secretaria Nacional de Aviação Civil, a ser criada na estrutura do ministério, segundo a assessoria de imprensa do ministério. Mas, diante da dificuldade para encontrar pessoas que aceitassem assumir uma das diretorias da agência reguladora, após a renúncia de três diretores, Jobim decidiu indicar a economista para o cargo. Uma da três vagas será ocupada pelo major-brigadeiro Allemander Jesus Pereira Filho, indicado para exercer o cargo em substituição a Jorge Luiz Brito Velozo, que pediu demissão no final do mês passado. Também renunciaram ao cargo de diretor da Anac Denise Abreu e Leur Lomanto.
47;"O presidente Luiz Inácio Lula da Silva afirmou nesta segunda-feira, durante o programa de rádio ""Café com o Presidente"", que vai anunciar obras de infra-estrutura que transformarão o Brasil em um ""verdadeiro canteiro de obras"". ""Quando eu voltar desta viagem pela América Central, nós vamos começar a anunciar as obras de infra-estrutura no que diz respeito a estradas, às ferrovias, a gasodutos, a tudo, a portos, a aeroportos, ou seja, tudo que tiver de infra-estrutura na área de transportes nós vamos anunciar também e começar a liberar o dinheiro para que as obras comecem a acontecer. Algumas já estão em andamento, outras vão começar a andar agora, outras ainda precisam de licenciamento. O dado concreto é que nós vamos fazer deste país um verdadeiro canteiro de obras em se tratando de infra-estrutura"", disse. Lula disse que a prioridade é a realização de obras nas regiões metropolitanas de grandes centros urbanos. ""Nós demos prioridade para regiões metropolitanas dos grandes centros urbanos brasileiros porque é lá que está o maior problema de degradação da moradia, degradação da estrutura familiar, violência, crime, narcotráfico, ou seja, quando nós chegarmos com urbanização de uma favela, o saneamento básico, junto vai chegar uma escola, junto vai chegar uma área de lazer, junto vai chegar um ponto de cultura, junto vai chegar, sabe, uma melhoria na segurança pública naquele bairro. E a novidade é o compromisso dos governadores."" O presidente afirmou ainda que o critério para os municípios e Estados contemplados com obras é técnico. ""O critério é eminentemente técnico, ou seja, eu não quero saber se o prefeito é do PFL, do PT, do PMDB, do PSDB, do PTB, do PR, do PC do B. Eu quero saber se aquela cidade tem as condições técnicas que permitem que este dinheiro seja aplicado e se tem o processo de necessidade da população. Então, o critério é um critério técnico. Ou seja, nós olhamos para a cara da população, para as necessidades da população e aí, se tiver o problema, recebe o dinheiro."""
